{
  "$schema": "https://json-schema.org/draft/2020-12/schema",
  "$id": "https://schemas.sovereignops.local/plugin-review/artifact-records-api-requests.schema.json",
  "title": "Plugin review artifact records API request fixture bundle",
  "type": "object",
  "additionalProperties": false,
  "required": [
    "schemaVersion",
    "generatedAt",
    "apiBase",
    "requests"
  ],
  "properties": {
    "schemaVersion": {
      "type": "string",
      "const": "plugin-review-artifact-records-requests.v1"
    },
    "generatedAt": {
      "type": "string",
      "pattern": "^\\d{4}-\\d{2}-\\d{2}T\\d{2}:\\d{2}:\\d{2}(?:\\.\\d{3})?Z$"
    },
    "apiBase": {
      "type": "string",
      "pattern": "^local://[a-z0-9][a-z0-9.-]{0,95}$"
    },
    "fixtureRefs": {
      "type": "array",
      "items": {
        "$schema": "https://json-schema.org/draft/2020-12/schema",
        "title": "Plugin review artifact records API fixture reference",
        "type": "object",
        "additionalProperties": false,
        "required": [
          "id",
          "fixturePath"
        ],
        "properties": {
          "id": {
            "type": "string",
            "pattern": "^[A-Za-z][A-Za-z0-9_.-]{0,95}$"
          },
          "fixturePath": {
            "type": "string",
            "pattern": "^(?!/)(?![A-Za-z]:)(?!.*(?:^|/)\\.\\.(?:/|$))(?!.*//)[A-Za-z0-9._/-]+\\.json$"
          }
        }
      }
    },
    "requests": {
      "type": "array",
      "minItems": 1,
      "items": {
        "$schema": "https://json-schema.org/draft/2020-12/schema",
        "title": "Plugin review artifact records API request fixture",
        "type": "object",
        "additionalProperties": false,
        "required": [
          "id",
          "title",
          "route",
          "request",
          "expect"
        ],
        "properties": {
          "id": {
            "type": "string",
            "pattern": "^[A-Za-z][A-Za-z0-9_.:-]{0,127}$"
          },
          "title": {
            "type": "string",
            "minLength": 1,
            "pattern": "^(?!.*(?:(?:\\b[A-Za-z]:[\\\\/][^\\s\"',;)}\\]]+|\\\\\\\\[^\\\\\\s\"',;)}\\]]+[\\\\][^\\s\"',;)}\\]]+|file://[^\\s\"',;)}\\]]+|/(?:Users|home|var|tmp|private|mnt|Volumes)/[^\\s\"',;)}\\]]+)|(?:^|[\\\\/])\\.codex-private(?:[\\\\/]|$)|[pP][rR][iI][vV][aA][tT][eE][- _]?[pP][lL][aA][nN](?:[- _]?[pP][aA][cC][kK])?|[pP][rR][iI][vV][aA][tT][eE][- _]?[mM][aA][rR][kK][eE][rR]|(?:[bB][eE][aA][rR][eE][rR]\\s+(?!\\[REDACTED\\])\\S{8,}|-----BEGIN [A-Z ]*PRIVATE KEY-----|(?:^|[^A-Za-z0-9])(?:sk|rk|pk|tok|pat|npm|ghp|gho)_[A-Za-z0-9_-]{8,}|(?:^|[^A-Za-z0-9])(?:sk|rk|pat|glpat|github_pat)-[A-Za-z0-9_-]{8,}|(?:[aA][pP][iI][_-]?[kK][eE][yY]|[aA][uU][tT][hH][oO][rR][iI][zZ][aA][tT][iI][oO][nN]|[cC][rR][eE][dD][eE][nN][tT][iI][aA][lL]|[pP][aA][sS][sS][wW][oO][rR][dD]|[pP][rR][iI][vV][aA][tT][eE][_-]?[kK][eE][yY]|[sS][eE][cC][rR][eE][tT]|[sS][eE][sS][sS][iI][oO][nN][_-]?[tT][oO][kK][eE][nN]|[tT][oO][kK][eE][nN])\\s*[:=]\\s*(?!\\[REDACTED\\])\\S+))).*\\S.*$"
          },
          "route": {
            "$schema": "https://json-schema.org/draft/2020-12/schema",
            "title": "Plugin review artifact records API route",
            "type": "object",
            "additionalProperties": false,
            "required": [
              "method",
              "path"
            ],
            "properties": {
              "method": {
                "type": "string",
                "enum": [
                  "GET",
                  "POST",
                  "PUT",
                  "PATCH",
                  "DELETE"
                ]
              },
              "path": {
                "type": "string",
                "pattern": "^/v[0-9]+/(?!.*//)(?!.*\\.\\.)[A-Za-z0-9._~:/-]+$"
              }
            }
          },
          "request": {
            "$schema": "https://json-schema.org/draft/2020-12/schema",
            "title": "Plugin review artifact records API request payload",
            "type": "object",
            "additionalProperties": false,
            "required": [],
            "properties": {
              "headers": {
                "type": "object",
                "additionalProperties": {
                  "type": "string",
                  "pattern": "^(?!.*(?:(?:\\b[A-Za-z]:[\\\\/][^\\s\"',;)}\\]]+|\\\\\\\\[^\\\\\\s\"',;)}\\]]+[\\\\][^\\s\"',;)}\\]]+|file://[^\\s\"',;)}\\]]+|/(?:Users|home|var|tmp|private|mnt|Volumes)/[^\\s\"',;)}\\]]+)|(?:^|[\\\\/])\\.codex-private(?:[\\\\/]|$)|[pP][rR][iI][vV][aA][tT][eE][- _]?[pP][lL][aA][nN](?:[- _]?[pP][aA][cC][kK])?|[pP][rR][iI][vV][aA][tT][eE][- _]?[mM][aA][rR][kK][eE][rR]|(?:[bB][eE][aA][rR][eE][rR]\\s+(?!\\[REDACTED\\])\\S{8,}|-----BEGIN [A-Z ]*PRIVATE KEY-----|(?:^|[^A-Za-z0-9])(?:sk|rk|pk|tok|pat|npm|ghp|gho)_[A-Za-z0-9_-]{8,}|(?:^|[^A-Za-z0-9])(?:sk|rk|pat|glpat|github_pat)-[A-Za-z0-9_-]{8,}|(?:[aA][pP][iI][_-]?[kK][eE][yY]|[aA][uU][tT][hH][oO][rR][iI][zZ][aA][tT][iI][oO][nN]|[cC][rR][eE][dD][eE][nN][tT][iI][aA][lL]|[pP][aA][sS][sS][wW][oO][rR][dD]|[pP][rR][iI][vV][aA][tT][eE][_-]?[kK][eE][yY]|[sS][eE][cC][rR][eE][tT]|[sS][eE][sS][sS][iI][oO][nN][_-]?[tT][oO][kK][eE][nN]|[tT][oO][kK][eE][nN])\\s*[:=]\\s*(?!\\[REDACTED\\])\\S+))).*\\S.*$"
                }
              },
              "body": {
                "oneOf": [
                  {
                    "type": "string",
                    "pattern": "^(?!.*(?:(?:\\b[A-Za-z]:[\\\\/][^\\s\"',;)}\\]]+|\\\\\\\\[^\\\\\\s\"',;)}\\]]+[\\\\][^\\s\"',;)}\\]]+|file://[^\\s\"',;)}\\]]+|/(?:Users|home|var|tmp|private|mnt|Volumes)/[^\\s\"',;)}\\]]+)|(?:^|[\\\\/])\\.codex-private(?:[\\\\/]|$)|[pP][rR][iI][vV][aA][tT][eE][- _]?[pP][lL][aA][nN](?:[- _]?[pP][aA][cC][kK])?|[pP][rR][iI][vV][aA][tT][eE][- _]?[mM][aA][rR][kK][eE][rR]|(?:[bB][eE][aA][rR][eE][rR]\\s+(?!\\[REDACTED\\])\\S{8,}|-----BEGIN [A-Z ]*PRIVATE KEY-----|(?:^|[^A-Za-z0-9])(?:sk|rk|pk|tok|pat|npm|ghp|gho)_[A-Za-z0-9_-]{8,}|(?:^|[^A-Za-z0-9])(?:sk|rk|pat|glpat|github_pat)-[A-Za-z0-9_-]{8,}|(?:[aA][pP][iI][_-]?[kK][eE][yY]|[aA][uU][tT][hH][oO][rR][iI][zZ][aA][tT][iI][oO][nN]|[cC][rR][eE][dD][eE][nN][tT][iI][aA][lL]|[pP][aA][sS][sS][wW][oO][rR][dD]|[pP][rR][iI][vV][aA][tT][eE][_-]?[kK][eE][yY]|[sS][eE][cC][rR][eE][tT]|[sS][eE][sS][sS][iI][oO][nN][_-]?[tT][oO][kK][eE][nN]|[tT][oO][kK][eE][nN])\\s*[:=]\\s*(?!\\[REDACTED\\])\\S+))).*\\S.*$"
                  },
                  {
                    "type": "number"
                  },
                  {
                    "type": "boolean"
                  },
                  {
                    "type": "null"
                  },
                  {
                    "type": "array"
                  },
                  {
                    "type": "object"
                  }
                ]
              }
            }
          },
          "expect": {
            "$schema": "https://json-schema.org/draft/2020-12/schema",
            "title": "Plugin review artifact records API expectation",
            "type": "object",
            "additionalProperties": false,
            "required": [
              "status"
            ],
            "properties": {
              "status": {
                "type": "integer",
                "minimum": 100,
                "maximum": 599
              },
              "contentType": {
                "type": "string",
                "minLength": 1,
                "pattern": "^[^\\s/]+/[^\\s]+$"
              },
              "kind": {
                "type": "string",
                "minLength": 1,
                "pattern": "^(?!.*(?:(?:\\b[A-Za-z]:[\\\\/][^\\s\"',;)}\\]]+|\\\\\\\\[^\\\\\\s\"',;)}\\]]+[\\\\][^\\s\"',;)}\\]]+|file://[^\\s\"',;)}\\]]+|/(?:Users|home|var|tmp|private|mnt|Volumes)/[^\\s\"',;)}\\]]+)|(?:^|[\\\\/])\\.codex-private(?:[\\\\/]|$)|[pP][rR][iI][vV][aA][tT][eE][- _]?[pP][lL][aA][nN](?:[- _]?[pP][aA][cC][kK])?|[pP][rR][iI][vV][aA][tT][eE][- _]?[mM][aA][rR][kK][eE][rR]|(?:[bB][eE][aA][rR][eE][rR]\\s+(?!\\[REDACTED\\])\\S{8,}|-----BEGIN [A-Z ]*PRIVATE KEY-----|(?:^|[^A-Za-z0-9])(?:sk|rk|pk|tok|pat|npm|ghp|gho)_[A-Za-z0-9_-]{8,}|(?:^|[^A-Za-z0-9])(?:sk|rk|pat|glpat|github_pat)-[A-Za-z0-9_-]{8,}|(?:[aA][pP][iI][_-]?[kK][eE][yY]|[aA][uU][tT][hH][oO][rR][iI][zZ][aA][tT][iI][oO][nN]|[cC][rR][eE][dD][eE][nN][tT][iI][aA][lL]|[pP][aA][sS][sS][wW][oO][rR][dD]|[pP][rR][iI][vV][aA][tT][eE][_-]?[kK][eE][yY]|[sS][eE][cC][rR][eE][tT]|[sS][eE][sS][sS][iI][oO][nN][_-]?[tT][oO][kK][eE][nN]|[tT][oO][kK][eE][nN])\\s*[:=]\\s*(?!\\[REDACTED\\])\\S+))).*\\S.*$"
              },
              "schemaVersion": {
                "type": "string",
                "minLength": 1,
                "pattern": "^(?!.*(?:(?:\\b[A-Za-z]:[\\\\/][^\\s\"',;)}\\]]+|\\\\\\\\[^\\\\\\s\"',;)}\\]]+[\\\\][^\\s\"',;)}\\]]+|file://[^\\s\"',;)}\\]]+|/(?:Users|home|var|tmp|private|mnt|Volumes)/[^\\s\"',;)}\\]]+)|(?:^|[\\\\/])\\.codex-private(?:[\\\\/]|$)|[pP][rR][iI][vV][aA][tT][eE][- _]?[pP][lL][aA][nN](?:[- _]?[pP][aA][cC][kK])?|[pP][rR][iI][vV][aA][tT][eE][- _]?[mM][aA][rR][kK][eE][rR]|(?:[bB][eE][aA][rR][eE][rR]\\s+(?!\\[REDACTED\\])\\S{8,}|-----BEGIN [A-Z ]*PRIVATE KEY-----|(?:^|[^A-Za-z0-9])(?:sk|rk|pk|tok|pat|npm|ghp|gho)_[A-Za-z0-9_-]{8,}|(?:^|[^A-Za-z0-9])(?:sk|rk|pat|glpat|github_pat)-[A-Za-z0-9_-]{8,}|(?:[aA][pP][iI][_-]?[kK][eE][yY]|[aA][uU][tT][hH][oO][rR][iI][zZ][aA][tT][iI][oO][nN]|[cC][rR][eE][dD][eE][nN][tT][iI][aA][lL]|[pP][aA][sS][sS][wW][oO][rR][dD]|[pP][rR][iI][vV][aA][tT][eE][_-]?[kK][eE][yY]|[sS][eE][cC][rR][eE][tT]|[sS][eE][sS][sS][iI][oO][nN][_-]?[tT][oO][kK][eE][nN]|[tT][oO][kK][eE][nN])\\s*[:=]\\s*(?!\\[REDACTED\\])\\S+))).*\\S.*$"
              },
              "pluginId": {
                "type": "string",
                "minLength": 1,
                "pattern": "^(?!.*(?:(?:\\b[A-Za-z]:[\\\\/][^\\s\"',;)}\\]]+|\\\\\\\\[^\\\\\\s\"',;)}\\]]+[\\\\][^\\s\"',;)}\\]]+|file://[^\\s\"',;)}\\]]+|/(?:Users|home|var|tmp|private|mnt|Volumes)/[^\\s\"',;)}\\]]+)|(?:^|[\\\\/])\\.codex-private(?:[\\\\/]|$)|[pP][rR][iI][vV][aA][tT][eE][- _]?[pP][lL][aA][nN](?:[- _]?[pP][aA][cC][kK])?|[pP][rR][iI][vV][aA][tT][eE][- _]?[mM][aA][rR][kK][eE][rR]|(?:[bB][eE][aA][rR][eE][rR]\\s+(?!\\[REDACTED\\])\\S{8,}|-----BEGIN [A-Z ]*PRIVATE KEY-----|(?:^|[^A-Za-z0-9])(?:sk|rk|pk|tok|pat|npm|ghp|gho)_[A-Za-z0-9_-]{8,}|(?:^|[^A-Za-z0-9])(?:sk|rk|pat|glpat|github_pat)-[A-Za-z0-9_-]{8,}|(?:[aA][pP][iI][_-]?[kK][eE][yY]|[aA][uU][tT][hH][oO][rR][iI][zZ][aA][tT][iI][oO][nN]|[cC][rR][eE][dD][eE][nN][tT][iI][aA][lL]|[pP][aA][sS][sS][wW][oO][rR][dD]|[pP][rR][iI][vV][aA][tT][eE][_-]?[kK][eE][yY]|[sS][eE][cC][rR][eE][tT]|[sS][eE][sS][sS][iI][oO][nN][_-]?[tT][oO][kK][eE][nN]|[tT][oO][kK][eE][nN])\\s*[:=]\\s*(?!\\[REDACTED\\])\\S+))).*\\S.*$"
              },
              "recordId": {
                "type": "string",
                "minLength": 1,
                "pattern": "^(?!.*(?:(?:\\b[A-Za-z]:[\\\\/][^\\s\"',;)}\\]]+|\\\\\\\\[^\\\\\\s\"',;)}\\]]+[\\\\][^\\s\"',;)}\\]]+|file://[^\\s\"',;)}\\]]+|/(?:Users|home|var|tmp|private|mnt|Volumes)/[^\\s\"',;)}\\]]+)|(?:^|[\\\\/])\\.codex-private(?:[\\\\/]|$)|[pP][rR][iI][vV][aA][tT][eE][- _]?[pP][lL][aA][nN](?:[- _]?[pP][aA][cC][kK])?|[pP][rR][iI][vV][aA][tT][eE][- _]?[mM][aA][rR][kK][eE][rR]|(?:[bB][eE][aA][rR][eE][rR]\\s+(?!\\[REDACTED\\])\\S{8,}|-----BEGIN [A-Z ]*PRIVATE KEY-----|(?:^|[^A-Za-z0-9])(?:sk|rk|pk|tok|pat|npm|ghp|gho)_[A-Za-z0-9_-]{8,}|(?:^|[^A-Za-z0-9])(?:sk|rk|pat|glpat|github_pat)-[A-Za-z0-9_-]{8,}|(?:[aA][pP][iI][_-]?[kK][eE][yY]|[aA][uU][tT][hH][oO][rR][iI][zZ][aA][tT][iI][oO][nN]|[cC][rR][eE][dD][eE][nN][tT][iI][aA][lL]|[pP][aA][sS][sS][wW][oO][rR][dD]|[pP][rR][iI][vV][aA][tT][eE][_-]?[kK][eE][yY]|[sS][eE][cC][rR][eE][tT]|[sS][eE][sS][sS][iI][oO][nN][_-]?[tT][oO][kK][eE][nN]|[tT][oO][kK][eE][nN])\\s*[:=]\\s*(?!\\[REDACTED\\])\\S+))).*\\S.*$"
              },
              "errorCode": {
                "type": "string",
                "minLength": 1,
                "pattern": "^(?!.*(?:(?:\\b[A-Za-z]:[\\\\/][^\\s\"',;)}\\]]+|\\\\\\\\[^\\\\\\s\"',;)}\\]]+[\\\\][^\\s\"',;)}\\]]+|file://[^\\s\"',;)}\\]]+|/(?:Users|home|var|tmp|private|mnt|Volumes)/[^\\s\"',;)}\\]]+)|(?:^|[\\\\/])\\.codex-private(?:[\\\\/]|$)|[pP][rR][iI][vV][aA][tT][eE][- _]?[pP][lL][aA][nN](?:[- _]?[pP][aA][cC][kK])?|[pP][rR][iI][vV][aA][tT][eE][- _]?[mM][aA][rR][kK][eE][rR]|(?:[bB][eE][aA][rR][eE][rR]\\s+(?!\\[REDACTED\\])\\S{8,}|-----BEGIN [A-Z ]*PRIVATE KEY-----|(?:^|[^A-Za-z0-9])(?:sk|rk|pk|tok|pat|npm|ghp|gho)_[A-Za-z0-9_-]{8,}|(?:^|[^A-Za-z0-9])(?:sk|rk|pat|glpat|github_pat)-[A-Za-z0-9_-]{8,}|(?:[aA][pP][iI][_-]?[kK][eE][yY]|[aA][uU][tT][hH][oO][rR][iI][zZ][aA][tT][iI][oO][nN]|[cC][rR][eE][dD][eE][nN][tT][iI][aA][lL]|[pP][aA][sS][sS][wW][oO][rR][dD]|[pP][rR][iI][vV][aA][tT][eE][_-]?[kK][eE][yY]|[sS][eE][cC][rR][eE][tT]|[sS][eE][sS][sS][iI][oO][nN][_-]?[tT][oO][kK][eE][nN]|[tT][oO][kK][eE][nN])\\s*[:=]\\s*(?!\\[REDACTED\\])\\S+))).*\\S.*$"
              },
              "redactionCount": {
                "type": "integer",
                "minimum": 0
              },
              "approvalSessionCount": {
                "type": "integer",
                "minimum": 0
              },
              "entryCount": {
                "type": "integer",
                "minimum": 0
              },
              "recordCount": {
                "type": "integer",
                "minimum": 0
              },
              "matches": {
                "type": "boolean"
              },
              "differenceCount": {
                "type": "integer",
                "minimum": 0
              },
              "summary": {
                "type": "object",
                "additionalProperties": {
                  "type": "integer",
                  "minimum": 0
                }
              },
              "statuses": {
                "type": "object",
                "additionalProperties": {
                  "type": "integer",
                  "minimum": 0
                }
              },
              "pluginIds": {
                "type": "object",
                "additionalProperties": {
                  "type": "integer",
                  "minimum": 0
                }
              }
            }
          }
        }
      }
    }
  }
}
